Frame 1: 342 bytes on wire (2736 bits), 342 bytes captured (2736 bits) on interface en0, id 0
Ethernet II, Src: Apple_59:ae:32 (f0:18:98:59:ae:32), Dst: Broadcast (ff:ff:ff:ff:ff:ff)
Internet Protocol Version 4, Src: 0.0.0.0, Dst: 255.255.255.255
User Datagram Protocol, Src Port: 68, Dst Port: 67
Dynamic Host Configuration Protocol (Discover)

Frame 2: 342 bytes on wire (2736 bits), 342 bytes captured (2736 bits) on interface en0, id 0
Ethernet II, Src: CiscoMer_1a:1e:88 (0c:8d:db:1a:1e:88), Dst: Apple_59:ae:32 (f0:18:98:59:ae:32)
Internet Protocol Version 4, Src: 192.168.99.1, Dst: 192.168.99.199
User Datagram Protocol, Src Port: 67, Dst Port: 68
Dynamic Host Configuration Protocol (Offer)

Frame 3: 342 bytes on wire (2736 bits), 342 bytes captured (2736 bits) on interface en0, id 0
Ethernet II, Src: Apple_59:ae:32 (f0:18:98:59:ae:32), Dst: Broadcast (ff:ff:ff:ff:ff:ff)
Internet Protocol Version 4, Src: 0.0.0.0, Dst: 255.255.255.255
User Datagram Protocol, Src Port: 68, Dst Port: 67
Dynamic Host Configuration Protocol (Request)

Frame 4: 342 bytes on wire (2736 bits), 342 bytes captured (2736 bits) on interface en0, id 0
Ethernet II, Src: CiscoMer_1a:1e:88 (0c:8d:db:1a:1e:88), Dst: Apple_59:ae:32 (f0:18:98:59:ae:32)
Internet Protocol Version 4, Src: 192.168.99.1, Dst: 192.168.99.199
User Datagram Protocol, Src Port: 67, Dst Port: 68
Dynamic Host Configuration Protocol (ACK)

Frame 5: 42 bytes on wire (336 bits), 42 bytes captured (336 bits) on interface en0, id 0
Ethernet II, Src: Apple_59:ae:32 (f0:18:98:59:ae:32), Dst: Broadcast (ff:ff:ff:ff:ff:ff)
Address Resolution Protocol (request)

Frame 6: 62 bytes on wire (496 bits), 62 bytes captured (496 bits) on interface en0, id 0
Ethernet II, Src: CiscoMer_1a:1e:88 (0c:8d:db:1a:1e:88), Dst: Apple_59:ae:32 (f0:18:98:59:ae:32)
Address Resolution Protocol (reply)

Frame 7: 77 bytes on wire (616 bits), 77 bytes captured (616 bits) on interface en0, id 0
Ethernet II, Src: Apple_59:ae:32 (f0:18:98:59:ae:32), Dst: CiscoMer_1a:1e:88 (0c:8d:db:1a:1e:88)
Internet Protocol Version 4, Src: 192.168.99.199, Dst: 35.176.240.100
User Datagram Protocol, Src Port: 59424, Dst Port: 53
Domain Name System (query)

Frame 8: 93 bytes on wire (744 bits), 93 bytes captured (744 bits) on interface en0, id 0
Ethernet II, Src: CiscoMer_1a:1e:88 (0c:8d:db:1a:1e:88), Dst: Apple_59:ae:32 (f0:18:98:59:ae:32)
Internet Protocol Version 4, Src: 35.176.240.100, Dst: 192.168.99.199
User Datagram Protocol, Src Port: 53, Dst Port: 59424
Domain Name System (response)

Frame 9: 78 bytes on wire (624 bits), 78 bytes captured (624 bits) on interface en0, id 0
Ethernet II, Src: Apple_59:ae:32 (f0:18:98:59:ae:32), Dst: CiscoMer_1a:1e:88 (0c:8d:db:1a:1e:88)
Internet Protocol Version 4, Src: 192.168.99.199, Dst: 128.119.245.12
Transmission Control Protocol, Src Port: 60779, Dst Port: 80, Seq: 0, Len: 0

Frame 10: 74 bytes on wire (592 bits), 74 bytes captured (592 bits) on interface en0, id 0
Ethernet II, Src: CiscoMer_1a:1e:88 (0c:8d:db:1a:1e:88), Dst: Apple_59:ae:32 (f0:18:98:59:ae:32)
Internet Protocol Version 4, Src: 128.119.245.12, Dst: 192.168.99.199
Transmission Control Protocol, Src Port: 80, Dst Port: 60779, Seq: 0, Ack: 1, Len: 0

Frame 11: 66 bytes on wire (528 bits), 66 bytes captured (528 bits) on interface en0, id 0
Ethernet II, Src: Apple_59:ae:32 (f0:18:98:59:ae:32), Dst: CiscoMer_1a:1e:88 (0c:8d:db:1a:1e:88)
Internet Protocol Version 4, Src: 192.168.99.199, Dst: 128.119.245.12
Transmission Control Protocol, Src Port: 60779, Dst Port: 80, Seq: 1, Ack: 1, Len: 0

Frame 12: 612 bytes on wire (4896 bits), 612 bytes captured (4896 bits) on interface en0, id 0
Ethernet II, Src: Apple_59:ae:32 (f0:18:98:59:ae:32), Dst: CiscoMer_1a:1e:88 (0c:8d:db:1a:1e:88)
Internet Protocol Version 4, Src: 192.168.99.199, Dst: 128.119.245.12
Transmission Control Protocol, Src Port: 60779, Dst Port: 80, Seq: 1, Ack: 1, Len: 546
Hypertext Transfer Protocol

Frame 13: 66 bytes on wire (528 bits), 66 bytes captured (528 bits) on interface en0, id 0
Ethernet II, Src: CiscoMer_1a:1e:88 (0c:8d:db:1a:1e:88), Dst: Apple_59:ae:32 (f0:18:98:59:ae:32)
Internet Protocol Version 4, Src: 128.119.245.12, Dst: 192.168.99.199
Transmission Control Protocol, Src Port: 80, Dst Port: 60779, Seq: 1, Ack: 547, Len: 0

Frame 14: 504 bytes on wire (4032 bits), 504 bytes captured (4032 bits) on interface en0, id 0
Ethernet II, Src: CiscoMer_1a:1e:88 (0c:8d:db:1a:1e:88), Dst: Apple_59:ae:32 (f0:18:98:59:ae:32)
Internet Protocol Version 4, Src: 128.119.245.12, Dst: 192.168.99.199
Transmission Control Protocol, Src Port: 80, Dst Port: 60779, Seq: 1, Ack: 547, Len: 438
Hypertext Transfer Protocol
Line-based text data: text/html (3 lines)

Frame 15: 66 bytes on wire (528 bits), 66 bytes captured (528 bits) on interface en0, id 0
Ethernet II, Src: Apple_59:ae:32 (f0:18:98:59:ae:32), Dst: CiscoMer_1a:1e:88 (0c:8d:db:1a:1e:88)
Internet Protocol Version 4, Src: 192.168.99.199, Dst: 128.119.245.12
Transmission Control Protocol, Src Port: 60779, Dst Port: 80, Seq: 547, Ack: 439, Len: 0

Frame 16: 66 bytes on wire (528 bits), 66 bytes captured (528 bits) on interface en0, id 0
Ethernet II, Src: CiscoMer_1a:1e:88 (0c:8d:db:1a:1e:88), Dst: Apple_59:ae:32 (f0:18:98:59:ae:32)
Internet Protocol Version 4, Src: 128.119.245.12, Dst: 192.168.99.199
Transmission Control Protocol, Src Port: 80, Dst Port: 60779, Seq: 439, Ack: 547, Len: 0

Frame 17: 66 bytes on wire (528 bits), 66 bytes captured (528 bits) on interface en0, id 0
Ethernet II, Src: Apple_59:ae:32 (f0:18:98:59:ae:32), Dst: CiscoMer_1a:1e:88 (0c:8d:db:1a:1e:88)
Internet Protocol Version 4, Src: 192.168.99.199, Dst: 128.119.245.12
Transmission Control Protocol, Src Port: 60779, Dst Port: 80, Seq: 547, Ack: 440, Len: 0

Frame 18: 66 bytes on wire (528 bits), 66 bytes captured (528 bits) on interface en0, id 0
Ethernet II, Src: Apple_59:ae:32 (f0:18:98:59:ae:32), Dst: CiscoMer_1a:1e:88 (0c:8d:db:1a:1e:88)
Internet Protocol Version 4, Src: 192.168.99.199, Dst: 128.119.245.12
Transmission Control Protocol, Src Port: 60779, Dst Port: 80, Seq: 547, Ack: 440, Len: 0

Frame 19: 66 bytes on wire (528 bits), 66 bytes captured (528 bits) on interface en0, id 0
Ethernet II, Src: CiscoMer_1a:1e:88 (0c:8d:db:1a:1e:88), Dst: Apple_59:ae:32 (f0:18:98:59:ae:32)
Internet Protocol Version 4, Src: 128.119.245.12, Dst: 192.168.99.199
Transmission Control Protocol, Src Port: 80, Dst Port: 60779, Seq: 440, Ack: 548, Len: 0
